s.no,source,startupName,foundedDate,description,ICB_industry,ICB_sector,startupClassification,groupClassification1,groupClassification2,startupClassification2,groupClassification3,businessModel,keyword1,keyword2,keyword3,city,state,startupStatus,Number of Founders,founder1Name,founder2Name,founder3Name
123,keyur,Gijutsu Solutions Pvt. Ltd.,2015,"An Android application that enables people to buy products from people around the neighborhood and allows people to sell products to those in their neighborhood. Its application allows buyers to discover products by nearby people, chat one-on-one with the seller, and get products; and sellers to sell products to nearby buyers.",Technology,Software & Computer Services,Internet_marketplace_and_eCommerce,Buy and Sale goods and products,,,,B2C,Application to buy and sell goods,,,Mumbai,Maharashtra,Angel investment,3,Sumit Gupta,Pulkit Gupta,Saurabh Jain
124,keyur,GINGERCRUSH,2015,"At Gingercrush, They offer you an innovative on demand retail platform where you can instantly shop, create or customize products to fit your personal style and taste. ",Consumer_services,Retail,Consumer_Products_and_Services,Personal Products,,,,B2C,Retail platform,,,Vadodara,Gujarat,Angel investment,2,Saumya Nidhi,Rajvi Makol,
125,keyur,Gladiris Technologies Pvt. Ltd.,2015,Gladiris Technologies Pvt. Ltd. develops and provides a platform that allows businesses to electronically transact and communicate with their vendors/suppliers and customers to get information about the business and their supply chain activities.,Industrials,Industrial goods and services,Software_and_Internet_Services,Communication services,,,,B2B,Platform for businesses to communicate with vendors,,,Pune,Maharashtra,Angel investment,3,Ashwani Kumar Singh Rathore,Harshal Ingale,Sandeep Sethi
126,keyur,Glam Online Pvt. Ltd.,2015,"Glam Online Pvt. Ltd. operates a chain of salons that provide beauty, grooming, and makeup services. The company also provides at home services. It allows customers to book appointments online. ",Consumer_services,Retail,Consumer_Products_and_Services,Specialized Consumer Services,Servicing,,,B2C,Beauty saloon,,,Noida,Uttar Pradesh,Angel investment,3,Sadiya Nazeem,Darakshan Husain,Feeroz
127,keyur,Glow Prime Technologies Pvt. Ltd.,2015,Glow Prime Technology Private Limited provides an online platform to book and get on demand beauty services at doorstep.,Consumer_services,Retail,Hyperlocal_and_Logistics, Home services,,,,B2C,Application to book beauty services,,,Bengaluru,Karnataka,Angel investment,3,Prateek Jain,Shashank Gupta,Kavish Desai
128,keyur,Godel Technologies Pvt. Ltd.,2015,Start-up that provides online medical advises through video chats,Healthcare,Healthcare,Health_Tech,Telemedicine and Online health care platforms,,,,B2C,Health care service providers through video chat,,,Bengaluru,Karnataka,Angel investment,3,Abhishek Kumar,Vikash Singh,Jugal Anchalia
129,keyur,Goldvip Technology Solutions Pvt. Ltd.,2014,It is a mobile app which is set to revolutionize retail business in India. It’s a customer club through which customers get cash back each time they visit and spend on retail outlets.,Technology,Software & Computer Services,Industrial_and_Business_Products_and_Services,Customer service for business,,,,B2B,O2O marketing  and data platform,Connecting consumer groups and retailers,,,Haryana,Angel investment,2,Ashish Munjal,Sameer Grover,
130,keyur,Grab,2014,Grab is a delivery service for businesses & merchants to bridge the gap between them and its consumer.,Consumer_services,Retail,Hyperlocal_and_Logistics,Delivery services and logistics,,,,B2B,Delivery service for businesses & merchants,,,Mumbai,Maharashtra,Angel investment,3,Jignesh Patel,Pratish Sanghvi,
131,keyur,GREX,2014,GREX is an innovative financial services institution involved in building solutions that combine high finance with high technology.,Financials,Financial services,Fin_Tech_and_Payments, Alternative Funding Platforms,Investment advisory and consultancy and financial consumer services,,,B2C,Financial services,,,Pune,Maharashtra,Angel investment,1,Mnish Kumar,,
132,keyur,Growthword Digital Pvt Ltd (IAMWIRE),2015,"It has been acting as a platform for startups and entrepreneurs to showcase their products to the world, and further acts like a bridge between startups and investors.",Technology,Software & Computer Services,Industrial_and_Business_Products_and_Services,Business Support Services,,,,B2B,Online platform for businesses to advertise and obtain fundraising support,,,Gurgaon,Haryana,Angel investment,2,Abhinav Dinesh Garg,Sugandh Dawan,
133,keyur,GS Farm Taaza Produce Pvt. Ltd.,2015,"It offers supply chain management services for various fresh produces that include broccoli, yellow zucchini, green zucchini etc. They also provides advisory services to the farmers on improving the yield and field operations. It serves farmers and business customers, including retail, eCommerce, hotels, restaurants, corporates, and institutions.",Industrials,Industrial goods and services,Hyperlocal_and_Logistics,Delivery services and logistics,,,,B2B,Fresh produce supply chain management services,,,Bengaluru,Karnataka,Angel investment,,Silicon calley veterans,,
134,keyur,Guiddoo World Travels Pvt. Ltd.,2014,"Guiddoo builds in-destination experiences for travellers and hence provides a one stop shop for a traveller during his “Experience” phase of travel and includes features like Tour and Activity Marketplace, Audio Visual Travel Content and Restaurant-Spa-Nightclub-Shopping Information and Booking Tools on the Customers Smartphone",Consumer_services,Travel and Leisure,Consumer_Products_and_Services,Travel & Tourism,,,,B2C,Travel and tourism,,,Mumbai,Maharashtra,Angel investment,4,Prashanth Choudhry,Nidhi Varma,Dharshan Sharma
135,keyur,Gymtrekker Fitness Pvt. Ltd.,2014,"Gymtrekker Fitness operates an online portal for gyms, and health and fitness centers. It enables users to browse and join gyms and fitness centers in their location. They also sells fitness accessories, sports accessories, health devices, health drinks and food, protein supplements, and vitamins and medicines through its online store. ",Healthcare,Healthcare,Health_Tech,Fitness & Wellness,,,,B2C,Gyms and fitness centers,Sells fitness and sports accessories,,Mumbai,Maharashtra,Angel investment,,,,
136,keyur,Hansel Software Pvt. Ltd.,2015,"Hansel.io is pioneering on-demand computing capabilities for remote applications. With a view to bring in hyper-agility in product management, Hansel.io makes applications respond to and act on data on the fly! ",Technology,Software & Computer Services,Software_and_Internet_Services,Enterprise Software,Internet and software development,,,B2B,Software developers for production management,,,Bengaluru,Karnataka,Angel investment,3,Varun Ramamurthy Dinakar,Parminder Singh,Mudit Krishna Mathur
137,keyur,Hatchery Software Private Limited,2014,"Hatchery Software Pvt. Ltd. provides Lookup, a messaging application that allows consumers to chat with local businesses in Bengaluru. Its application allows users to make reservations, book appointments, and find prices and availability of products/services at local businesses.",Technology,Software & Computer Services,Social_Platforms,Website for information,,,,B2C,App which connects customers and local businesses,,,Bengaluru,Karnataka,Angel investment,,,,
138,keyur,HIPSHIP,2014,"HIpship logistics is a startup based out of Bangalore. Its an online platform, a first of kind in india for logistic services and the companies aims to build better relationships with their customers and prospects. ",Technology,Software & Computer Services,Hyperlocal_and_Logistics,Delivery services and logistics,,,,B2B,Cargo and freight company,Delivery service to businesses,,Bengaluru,Karnataka,Angel investment,1,Ankit Sethia,,
139,keyur,Holachef Hospitality Pvt. Ltd.,2014,"Holachef curates Chefs ranging from Executive Chefs to Amateurs and allows them creative freedom through their signature dishes. The company manages the logistics of the food (packaging, storage & delivery).",Consumer_goods,Food and beverage,Consumer_Products_and_Services,Food Products,Hotels & Restaurants,Hyperlocal_and_Logistics, Food Products,B2C,Home food delivery,,,Mumbai,Maharashtra,Angel investment,2,Anil gelra,Saurabh saxena,
140,keyur,Holamed Healthcare Technologies Pvt. Ltd.,2016,HolaMed Healthcare Technologies Pvt. Ltd. develops an online platform that enables users to compares prices and book various diagnostics tests. Its platform enables users select their prescribed test from a range of available options, compare various labs and hospitals in terms of features and choose the best one for them,Healthcare,Healthcare,Health_Tech,Healthcare Analytics and Software,,,,B2C,Platform to compare and book diagnostics tests,,Mumbai,Maharashtra,Angel investment,1,Anurag Mundhada,,
141,keyur,Homevista Decor and Furnishing Pvt. Ltd.,2014,"Homevista Decor and Furnishing Pvt Ltd provides interior design services to home-builders. It offers interior designers services that help clients in planning their home, as well as helps them in designing kitchens, wardrobes, entertainment units, crockery units, study tables, and shoe racks.",Industrials,Industrial goods and services,Internet_marketplace_and_eCommerce,Home and furniture,,,,B2B,Interior designing,,,Bengaluru,Karnataka,Angel investment,3,Srikanth B Iyer,Rama Harinath,Vivek M P
142,keyur,HOSTRA SYSTEM PRIVATE LIMITED,2014,"Hostra Systems Pvt. Ltd. operates RoomCentral, a booking engine and a cloud-based property management system that offers property owners with tools and solutions for reservation and property management.",Technology,Software & Computer Services,Software_and_Internet_Services,Cloud Infrastructure,,,,B2B,Helps hotels for reservation and property management,,,Bengaluru,Karnataka,Angel investment,1,Atul Prabhu,,
143,keyur,Houssup Services Pvt. Ltd.,2016,"Houssup.com aims at  renovation of a space by inculcating technical interventions of modern visual technologies like Augmented Reality, Virtual tours & Artificial Intelligence and to create an end to end ecommerce platform for all the interior designing needs for designers as well as consumer.",Technology,Software & Computer Services,Software_and_Internet_Services,Software services for consumers,,Consumer_Products_and_Services,Home Improvement Retailers,B2C,Interior designing,Home furninshing portals,,Jaipur,Rajasthan,Angel investment,4,Hemanth Singh,Raghav Mundra,Devendra Baghel
144,keyur,Hugefly Technologies Pvt. Ltd.,2015,"Hugefly which provides wesbite search, recommendation & personalization services to eCommerce firms",Technology,Software & Computer Services,Industrial_and_Business_Products_and_Services,Business Support Services,,,,B2B,Personalizing Services to e-commerce,,,Pune,Maharashtra,Angel investment,2,Dhuruv Chaudary,Amit Chaudary,
145,keyur,Ideope Media Pvt. Ltd.,2014,"A media platform that fosters entrepreneurship and source for digital culture and innovation for a connected generation. The company creates and curates India specific stories and profiles startups, reviews new Internet products, and technology news.",Consumer_services,Media,Media_Advertising_and_Gaming,Media,,,,B2C,Media platform ,,,Delhi,,Angel investment,1,Viabhav Agarwal,,
146,keyur,Immersion Online Services Pvt. Ltd.,2014,"Immersion Online Services Pvt. Ltd. operates a Website that provides online interior design services. It provides online interior design themes and 3D video of home according to floor plan, as well as design implementation, delivery and assembling, and support services.",Technology,Software & Computer Services,Internet_marketplace_and_eCommerce,Home and furniture,,,,B2B,Online Interior designing,,,Bengaluru,Karnataka,Angel investment,3,Kiran Singh,Ishwar Sundararaman,Arvind
147,keyur,Imprimatur Printing Services Pvt. Ltd.,2014,"Imprimatur Printing Services Pvt Ltd. operates a marketplace for online printing. The company sells various products for printing, which include apparels, stickers, mugs, bags, note books, and other products online.",Technology,Software & Computer Services,Internet_marketplace_and_eCommerce,Marketplace,,,,B2C,Market place for online printing,,,Chennai,Tamil Nadu,Angel investment,2,Surya Shankar,Isaac John,
148,keyur,Inayo,2015,"Startups that delivers on orders, Medicines, Patanjali, Ayurvedic products from the convenience of your home or office ",Consumer_services,Retail,Hyperlocal_and_Logistics,Delivery services and logistics,,,,B2C,Home delivery of ayurvedic products,Delivery of medical products,,Mumbai,Maharashtra,Angel investment,3,Raunak Jain,Abhishek Sinha,Purna Chandra Patro
149,keyur,Incredible Technologies Pvt. Ltd.,2015,Incredible Technologies Pvt. Ltd. operates an online marketplace for buying and selling pre-owned two wheelers.,Technology,Software & Computer Services,Internet_marketplace_and_eCommerce,Buy and Sale goods and products,,,,B2C,Buying and selling of pre-owned two-wheelers,,,Mumbai,Maharashtra,Angel investment,1,Nikhil Jain,,
150,keyur,Indifi,2015,"Startup which gives loans to all kinds of business of e-commerce,hospitality,travel,retai or trading easily and quikly",Financials,Financial services,Fin_Tech_and_Payments, Alternative Funding Platforms,Crowdfunding,,,B2B2C,Business and imidividual Loan providers ,,,Gurgaon,Haryana,Angel investment,3,Sundeep sahi,Alok mittal,Siddharth mahanot
151,Keyur,Infinity Assurance Solutions Pvt. Ltd.,2014,Infinity Assurance Solutions specializes in Service Administration including Manufacturer Warranty and creating & managing warranty products. ,Consumer_services,Retail,Consumer_Products_and_Services,Automobiles & Auto Parts services,,,,B2C,Warranty services for products,,,Delhi,,Angel investment,2,R.K Goel,Puneet Gargya,
152,keyur,INFINYPOOL ONLINE PAYMENT SOLUTION INDIA PRIVATE LIMITED,2014,"Simple and convenient platform that lets you pool money with your group of friends, colleagues or anyone for that matter in a seamless manner.",Financials,Financial services,Fin_Tech_and_Payments,Crowdfunding,,,,B2C,Money pooling platform,,,Delhi,,Angel investment,2,Rohit Taneja,Ankit Singh,
153,keyur,Infomoko Technology Pvt. Ltd.,2014,"Infomoko Technology Pvt. Ltd. owns and operates a Website to find local services for moms and babies. It provides information in the areas of activities and learning, including day care, enhanced learning, playgroup, indoor play area, online edutainment etc",Technology,Software & Computer Services,Social_Platforms,Website for information,,,,B2C,Website of information for mothers ,Online source for parents,,Mumbai,Maharashtra,Angel investment,2,Mitesh Karia,Naiyya Saggi,
154,keyur,Inner Chef Pvt. Ltd.,2015,"InnerChef is an online food discovery and delivery experience that will make the chef in you come alive. Order your favourite dishes and experience the thrill of adding, mixing, tossing and plating, all within 20 minutes. ",Consumer_services,Retail,Hyperlocal_and_Logistics, Food Products,,,,B2C,Food delivery ,,,Gurgaon,Haryana,Angel investment,1,Rajesh Sawhney,,
155,Keyur,Innovcare Lifesciences Pvt. Ltd.,2014,"Innovcare Lifesciences Pvt. Ltd. is engaged in the development and production of nutraceuticals. It offers products for arthritis care, pain management, women's health care, phyto medicine/nutrient, and skin and hair care",Healthcare,Healthcare,Health_Tech,Nutraceuticals and allied products,,,,B2C,Development and production of nutraceuticals,,,Mumbai,Maharashtra,Angel investment,,,,
156,Keyur,Instabounce,2015,InstaBounce are never too late booking the best events in town so bring it on and put your party shoes on.,Consumer_services,Retail,Consumer_Products_and_Services,Event Management,Travel & Tourism,,,B2C,Booking- Travel,Event management,,Delhi,,Angel investment,,,,
157,keyur,InstaLively,2014,"The InstaLively platform helps broadcast any event LIVE in just a single click, and directly link it up to your Youtube Channel.focus is on Instant Video/ Audio Digitization on low 3G bandwidths using just a Mobile app ",Technology,Software & Computer Services,Media_Advertising_and_Gaming,Broadcasting,,,,B2B2C,Live broadcasting of events,,,Delhi,,Angel investment,2,Prakhar Khanduja,Karthick Vidyanath,
158,keyur,INSTAPROC,2015,Instaproc is an intelligent business procurement assistance application. It is designed to cater to businesses across size and life cycle stages. This easy to use application allows businesses flexibility to manage existing vendors and enables new vendor participation to fulfill published requirements.,Technology,Software & Computer Services,Industrial_and_Business_Products_and_Services,Customer service for business,,,,B2B,Business procurement assistance application,,,Noida,Uttar Pradesh,Angel investment,1,Anish Popli,,
159,keyur,INSTAVANS,2015,Instavans is an on-demand platform for shippers and truckers.,Technology,Software & Computer Services,Hyperlocal_and_Logistics,Delivery services and logistics,Transportation Services,,,B2B,On-demand platform for shippers and truckers,,,Bengaluru,Karnataka,Angel investment,2,Vinay Goyal,Sanjay Shah,
160,Keyur,Intruo Technologies Pvt. Ltd.,2014,"Intruo Technologies Pvt Ltd. provides Intruo, a reviews platform for interior designers, carpenters, painters, and architects.",Consumer_services,Retail,Consumer_Products_and_Services,Specialized Consumer Services,,,,B2C,Interior designing,,,Bengaluru,Karnataka,Angel investment,1,Alok Goel,,
161,Keyur,InventryX Systems Pvt. Ltd.,2015,"Customers can trade in raw materials, work in products, finished goods or non-OEM items excess inventory. The platform caters to 12 industrial categories like Auto, Bearings, and Construction etc. within which various sub categories have been defined. The platform has been designed to ensure that customers can search and upload their requirements specifically.",Industrials,Industrial goods and services,Consumer_Products_and_Services,Automobiles & Auto Parts services,,,,B2B,Trading with inventory,,,pune,Maharashtra,Angel investment,1,Milind Joshi ,,
162,Keyur,Jiyo Natural Private Limited,07/05,"Jiyo Natural, a startup that offers personalised nutritionally balanced, calorie monitored and chemical free food",Consumer_goods,Food and beverage,Consumer_Products_and_Services,Food Products,,,,B2C,Food delivery,,,Bengaluru,Karnataka,Angel investment,3,Rajesh Singh,Gauarv Bhalotia,Sunandini Sharma
163,keyur,JOBICK,2015,"Talentiser Labs develops and runs job and talent discovery application, Jobick. It helps find premium jobs using match making algorithms.",Technology,Software & Computer Services,Software_and_Internet_Services,Enterprise Software,,,,B2C,Job and talent discory application,,,Noida,Karnataka,Angel investment,3,Ravi Wadhwa,Mohit Mirwani,Jitendra Singh
164,Keyur,Jobspire Technologies Pvt. Ltd.,2014,Jobspire is a Visual and experiential job search platform that helps Indians aspire to find a job they'll truly love.,Consumer_services,Retail,Industrial_and_Business_Products_and_Services,Business Training & Employment Agencies,,,,B2B2C,Employment agencies,,,Bengaluru,Haryana,Angel investment,1,Varun Mayya,,
165,Keyur,JoeHukum,2015,"JoeHukum Is Your Virtual Personal Assistant. From Flight Booking To Food Delivery,",Consumer_services,Retail,Internet_marketplace_and_eCommerce,Booking,,,,B2C,Virtual Personal Assistant,,,Gurgaon,,Angel investment,1,Ajeet Singh kushwaha,,
166,Keyur,Jugnoo,07/05, Jugnoo is a phenomenon that has changed the way people choose to travel. Jugnoo is India's largest technology driven on-demand auto rickshaw aggregator.,Consumer_services,Travel and Leisure,Hyperlocal_and_Logistics,"Taxi Services, Automobile pooling & Travel",,,,B2C, auto rickshaw aggregator,,,Chhattisgarh,,Angel investment,2,Samar Singal,Chinmay Agarwal,
167,Keyur,Justdakhila.com,2015,"Just Dakhila is a first of its kind cloud based admission system.It is an advanced tech based system conceived by parents, consulted by school authorities, promoted by governmental policies and rapidly changing internet demographics in Indian landscape. It is been developed with a perspective to address gaps and issues in existing process of admission.",Technology,Software & Computer Services,Software_and_Internet_Services,Cloud Infrastructure,,Edu_Tech,Online or other forms of student support,B2B,School admissions ,Connects parent and school management,,Delhi,,Angel investment,2,V.K. Jain,Ankur Gupta,
168,Keyur,JustDoc,2015,Consulting a doctor has become easier. Sit at home and call your doctor. Relax we've taken care of everything,Healthcare,Healthcare,Health_Tech,"Clinics, Hospitals, and Health Care Providers ",,,,B2C,Consultation of a doctor,,,Bengaluru,Karnataka,Angel investment,3,Abhishek Kumar,Vikash Singh,Jugal Anchalia
169,Keyur,Kickstart Human Capital Solutions Pvt. Ltd.,2015,Kickstart Jobs provides a platform to connect entry level candidates with prospective employers and vice versa.,Technology,Software & Computer Services,Industrial_and_Business_Products_and_Services,Business Training & Employment Agencies,,,,B2B2C,Employment agencies,,,Gurgaon,Haryana,Angel investment,2,Samriddhi Malhotra,Abhishek Srivastava,
170,Keyur,Kinematic Foodtech Pvt. Ltd.,2015,Kinematic Foodtech Private Ltd. provides food delivery services in Bengaluru. The company also provides franchise services. It enables customers to order food online. ,Consumer_services,Retail,Hyperlocal_and_Logistics, Food Products,,,,B2C,Food delivery ,,,Bengaluru,Karnataka,Angel investment,3,Ritesh Kumar Dwivedy,Kumar Setu,Abhishek Mnadal
171,keyur,KleverKid,2014,"KleverKid makes it ridiculously simple for parents to find, compare, and book the best classes for their kids in their neighborhood.",Technology,Software & Computer Services,Edu_Tech,Educational products and Services,,,,B2C,App to find and compare kids classes,,,Delhi,,Angel investment,1,Shabnam Aggarwal,,
172,keyur,Knit,2014,"Knit offers teachers a free and simple way to text parents. They made messaging one-way and kept phone numbers private. Every teacher can use it to send out reminders, homework, group pics and what not. Just create your classroom and invite parents.",Technology,Software & Computer Services,Edu_Tech,IT and Mobile solutions for Education delivery,,,,B2C,One way messaging app,,,Mumbai,Maharashtra,Angel investment,1,Vikas Chahar,,
173,Keyur,Kolabro,2014,"Kolabro Business Solutions Pvt Ltd. develops an online platform for real estate brokers. It offers tools to connect with broker network, generate leads for listings or requirements, manage agents and clients, and create Websites for brokerage business and projects. The company also provides services, including branding, broker connect, digital marketing, and virtual number solutions",Technology,Software & Computer Services,Social_Platforms,Connect to Professionals,,,,B2C,Connecting real estate brokers and clients,,,Gurgaon,Haryana,Angel investment,1,Biju Menon,,
174,Keyur,KountMoney,07/05,KountMoney is an online platform that connects creditworthy borrowers across India to institutional lenders. The borrowers are salaried employees who are looking for unsecured loans at lower interest rate and quick disbursal.,Consumer_services,Retail,Fin_Tech_and_Payments, Banking and Non Banking Financial services,,,,B2B2C,Connects lenders and borrowers,,,Bengaluru,Karnataka,Angel investment,2,Abhishek Periwal,DeepakModak,
175,Keyur,LazyLad,07/05,"LazyLad offers an application that enables its user to shop, and get groceries, stationeries, and more delivered from local stores.",Consumer_goods,Food and beverage,Hyperlocal_and_Logistics,Online Grocery,,,,B2C,Online shopping,,,Gurgaon,Haryana,Angel investment,1,Saurabh Singla,,
176,Keyur,Leaf Innovation Pvt. Ltd.,2015,"Leaf Innovation Pvt. Ltd. designs and develops a wearable smart security device. Its product includes SAFER, a device that sends instant alerts to selected guardian to inform them about users location. The company also offers real time location information and notifications.",Technology,Software & Computer Services,Software_and_Internet_Services,Internet and software development,,,,B2C,Development of safer device,,,Delhi,,Angel investment,,,,
177,Keyur,Leaf Wearables,2015,Leaf Wearables is a tech startup that designs smart jewelry products for women’s safety. The company’s products can be used to trigger an alarm and send signals to pre-identified phone numbers in case of emergency.,Consumer_goods,personal and household goods,Consumer_Products_and_Services,Clothing & Accessories,,,,B2C,Smart jewellery product,Triggers alarm and signals,,Delhi,,Angel investment,5,Avinash Bansal,Ayush Banka,Chiraag Kapil
178,Keyur,Legal Raasta Technologies Pvt. Ltd.,06/15,LegalRaasta.com is a technology platform to simplify legal and business related matters.,Industrials,Industrial goods and services,Industrial_and_Business_Products_and_Services,Professional services,,,,B2B,Legal services to business,,,Delhi,,Angel investment,3,Pulkit Jain,Kanika Gupta,Himsanhu Jain
179,Keyur,Legistify Services Pvt. Ltd.,2014,Legistify is an online legal facilitation platform with an aim to bring in disruption and transparency in the legal system of our nation. We develop technology based services for meeting your legal requirements. ,Consumer_services,Retail,Consumer_Products_and_Services,Professional Services,,,,B2B2C,Legal related services to individuals,,,Noida,Uttar Pradesh,Angel investment,1,Akshat Singhal,,
180,Keyur,Lendingkart,2014,Lendingkart is an online financing company dedicated to help entrepreneurs and small businesses with Working Capital Loans.,Financials,Banks,Fin_Tech_and_Payments, Banking and Non Banking Financial services,,,,B2B,Financial services, Helps to get loan,,Ahmedabad,Gujarat,Angel investment,2,HarshvardhanLunia,Mukul Sachan,
