s.no,source,startupName,foundedDate,description,ICB_industry,ICB_sector,startupClassification,groupClassification1,groupClassification2,startupClassification2,groupClassification3,businessModel,keyword1,keyword2,keyword3,city,state,startupStatus,Number of Founders,founder1Name,founder2Name,founder3Name
181,Keyur,Lets Service Automotive Technologies Pvt. Ltd.,2015,An on-demand marketplace and booking platform for two-wheeler servicing.,Consumer_services,Retail,Internet_marketplace_and_eCommerce,Booking,,,,B2C, Booking- two wheeler servicing,,,Bengaluru,Karnataka,Angel investment,3,Sachin Radder,Sachin Vasanth Shenoy,Girish.G
182,Keyur,LetsTransport,2015,"Lets transport is a “Last mile” logistics solution provider. Their solutions are reliable, professional, economical and structured to serve businesses as well as consumers",Consumer_services,Retail,Hyperlocal_and_Logistics,Delivery services and logistics,,,,B2B2C,Logistics services,Both consumers and business,,Bengaluru,Karnataka,Angel investment,2,Pushkar Singh,Sudarshan Ravi,
183,Keyur,L-Fast Brands Pvt. Ltd.,2015,"L-FAST Brands Pvt Ltd. operates an online marketplace for wedding venues and vendors. It allows users to find banquet halls, lawns, hotels, five star hotels, heritage properties, resorts, beach venues, destination wedding venues, and popular venues; bridal wear, jewelry, accessories, and gifting products; and photographers, makeup artists, mehendi artists, caterers, invitation cards, wedding planners, and decorators.",Consumer_services,Retail,Consumer_Products_and_Services,Event Management,,,,B2C,Event management -marriages,,,Mumbai,Maharashtra,Angel investment,1,Paras Batra,,
184,Keyur,Licious,2015,"Licious aimed at solving the perennially existing problem of finding safe, delectable, trustworthy fresh meat in India.",Consumer_goods,Food and beverage,Consumer_Products_and_Services,Food Products,,,,B2C, meat business,,,Bengaluru,Karnataka,Angel investment,2,Abhay Hanjura,Vivek Gupta,
185,Keyur,LiveNutriFit HealthTech Pvt. Ltd.,2015,"LiveNutriFit is a integrative healthcare organization that focus on lifestyle modification, nutrition optimization, and functional fitness.",Healthcare,Healthcare,Health_Tech,Fitness & Wellness,,,,B2C,Fittness and wellness  ,,,Delhi,,Angel investment,1,Gaurav Jalote,,
186,Keyur,LoanCircle,2015,"LoanCircle provides people with quick access to loans, at the best possible rates suited for a person.",Consumer_services,Retail,Consumer_Products_and_Services,Professional Services,,,,B2C,Legal related services to business,,,,,Angel investment,2,TanjuMendiratta,Mayank Kumar,
187,keyur,Loanzen Technologies Pvt. Ltd.,2015,Loanzen helps small businesses get unsecured working capital loans against their pending invoices.,Financials,Financial services,Fin_Tech_and_Payments, Alternative Funding Platforms,,,,B2B,Short term loans providers to small scale entrepreneurs ,Provides unsecured working capital loans,,Bengaluru,Karnataka,Angel investment,2,Madhu sudhan,Venkatesh sankaraman,
188,Keyur,Lodestar Education Services Pvt. Ltd.,2015,"Lodestar is India's first scientific career guidance program for class 10 students. The program helps parents and children make a â€˜smart' career decision in a simple and easy way by using accurate data, highly evolved scientific decision making tools. Our program offers exposure to over 250 exciting career options, expert guidance by trained specialists, and individual attention to each child, and a complete final career plan at the end of the programme.",Technology,Software & Computer Services,Edu_Tech,Student Counselling and Guidance,,,,B2C,Counselling -education and career,,,Bengaluru,Karnataka,Angel investment,2,Murlidhar S ,Subodh Jindal,
189,Keyur,LogiNext Solutions Pvt. Ltd.,,"LogiNext Solutions Pvt Ltd. helps logistics and supply chain companies. The Company focuses on real-time communication, real-time analysis of missed, pending and delivered orders, transport analytics applications, tracking, pick-up and delivery automation, merge retail distribution with e-tail deliveries, and keep records of returns and reverse logistics.",Technology,Software & Computer Services,Hyperlocal_and_Logistics,Delivery services and logistics,,,,B2C,Logistics services,,,Mumbai,Maharashtra,Angel investment,1,Manisha Raisinghani,,
190,Keyur,Lookup,2014,Lookup is a free and secure messaging app which helps consumers chat with local businesses or shops.,Telecommunication,Telecommunication,Software_and_Internet_Services,Communication services,,,,B2C,Messaging app,,,Bengaluru,Karnataka,Angel investment,1,Deepak Ravindra,,
191,Keyur,Lybrate India Private Limited,2014,"It is inolved in Legal, accounting, book-keeping and auditing activities; tax consultancy; market research and public opinion polling; business and management consultancy",Financials,Financial services,Fin_Tech_and_Payments, Banking and Non Banking Financial services,,,,B2B,Legal and accounts working area,,,Delhi,,Angel investment,1, Saurabh Arora,,
192,Keyur,MagicTiger,2015,"MagicTiger is a one stop shop. Be it groceries, food, movie tickets, travel and anything at one roof.onlie platform.",Consumer_services,Retail,Internet_marketplace_and_eCommerce,Marketplace,,,,B2C,Online shopping,,,Bengaluru,Karnataka,Angel investment,,,,
193,keyur,Mass Blurb Pvt. Ltd.,,Mass Blurb runs an SaaS-based online marketing startup focused on restaurants,Technology,Software & Computer Services,Industrial_and_Business_Products_and_Services,Customer service for business,,,,B2B,Providing customer engagement to restaurants,Marketing platform for restaurants,,Mumbai,Maharashtra,Angel investment,2,Sanket shah,Pankit chheda,
194,keyur,MealHopper,,Startup which bring you food just the way you like it,Consumer_goods,Food and beverage,Consumer_Products_and_Services,Food Products,Servicing,Hyperlocal_and_Logistics, Food Products,B2C,Food delivery ,,,Gurgaon,Haryana,Angel investment,1,Aatish kumar,,
195,Keyur,Medikoe,2015,"Medikoe provides you discovery of services which are personally verified and can be trusted. Medikoe wants to connect users with the all healthcare and wellness service providers to make sure the convenience, trust affordability and availability in your neighbourhood.",Healthcare,Healthcare,Health_Tech,Fitness & Wellness,,,,B2C,Health care social network,,,Bengaluru,Karnataka,Angel investment,1,Sreevalsan Menon,,
196,Keyur,Medinfi,2014,Medinfi is India's first pure-play healthcare content platform which offers information on nearby doctors and clinics to its users. ,Telecommunication,Telecommunication,Software_and_Internet_Services,Communication services,,,,B2C, Information about Doctors,,,Bengaluru,Karnataka,Angel investment,2,Ravi Shankar Mishra,Himani Mishra,
197,Keyur,Meesho,2015,"Meesho is a mobile-first e-commerce platform for the specific needs of small businesses in India. Businesses can create an online shop within seconds, share on WhatsApp and Facebook, keep customers updated with new products, get new customers leads in real-time and collect payments over chat easily",Technology,Software & Computer Services,Social_Platforms,Social platforms for industrial services,,,,B2B,Social platform -marketing ,,,Bengaluru,Karnataka,Angel investment,2,Sanjeev Barnwal,Vidit Aatrey,
198,Keyur,Metropolitan Lifespace Real Estate Developers Pvt. Ltd.,2015,"It is inolved in Real estate activities with own or leased property. This class includes buying, selling, renting and operating of self-owned or leased real estate such as apartment building and dwellings, non-residential buildings, developing and subdividing real estate into lots etc. Also included are development and sale of land and cemetery lots, operating of apartment hotels and residential mobile home sites.",Financials,Real estate,Real_estate,"Buy , Rent and Sell Property",,,,B2C,Real estate,,,Mumbai,Maharashtra,Angel investment,,,,
199,Keyur,Mister Homecare Services Pvt. Ltd.,2015,"Mister Homecare Services Pvt. Ltd., an on-demand home services company, provides professional deep cleaning and pest control services. The company offers cleaning services home’s kitchen, bathrooms, bedrooms, and other living areas; surface management that covers mirrors, windows, ceilings and floors, and treatment of wooden and steel surfaces etc. It also provides pest control services, including general pest management, rodent, termite, bed bugs, and termite control services etc",Consumer_services,Retail,Consumer_Products_and_Services,Specialized Consumer Services,,,,B2C,House cleaning services,Pest control services,,Mumbai,Maharashtra,Angel investment,1,Sahil Vora,,
200,Keyur,MoEngage India Private Limited,07/05,MoEngage is a world-class User Analytics and Engagement platform for Mobile Marketing,Technology,Software & Computer Services,Industrial_and_Business_Products_and_Services,Business Support Services,,,,B2B,Mobile marketing,,,Bengaluru,Karnataka,Angel investment,2,Yashwanth Kumar,Raviteja Dodda,
201,Keyur,Mohalla Tech Pvt. Ltd.,2015,"Mohalla Tech Pvt. Ltd. develops a a regional language chat application, ShareChat. The application allows users to share videos, jokes, audio songs, and images in Hindi, Telugu, Marathi, and Malayalam.",Consumer_services,Media,Media_Advertising_and_Gaming,Media and entertainment,,,,B2C,Shares media of different languages,,,Bengaluru,Karnataka,Angel investment,3,Farid Ahsan,Bhanu Singh,Anukush Sachdeva
202,Keyur,Moneyvation Technologies Pvt. Ltd.,2015,"Moneyvation Technologies Private Limited operates an online platform that approves personal loans for people in India. Its platform offers loans for online purchases, rent security, medical emergency, credit card refinancing, wedding expenses, home improvement, vacation expenses, two-wheeler purchase, and other needs. ",Financials,Banks,Fin_Tech_and_Payments, Banking and Non Banking Financial services,,,,B2C,Personal loans approval,,,Bengaluru,Karnataka,Angel investment,1,Tanuj  Mendiratta,,
203,Keyur,Moonshots Internet Pvt. Ltd.,2015,"Moonshots Internet Private Limited provides online portal for delivery of goods. Its products include Opinio; an online portal and mobile application for delivery of products from restaurants, grocery outlets, laundry, and pharmacies.",Technology,Software & Computer Services,Hyperlocal_and_Logistics,Delivery services and logistics,,,,B2C,Logistics services,,,Bengaluru,Karnataka,Angel investment,2,Mayank Kumar,Lokesh Jangid,
204,Keyur,Motomojo Technologies Pvt. Ltd.,2015,"MotoMojo, a mobile app based vehicle maintenance startup",Consumer_services,Retail,Internet_marketplace_and_eCommerce,Booking,,,,B2C,Booking - vechile service,,,Maharashtra,,Angel investment,1,UttamArjun,,
205,Keyur,mShipper,2015,mShipper is a crowdshipping application connecting low weight consignment senders to registered freelancer shippers.,Consumer_services,Retail,Hyperlocal_and_Logistics,Delivery services and logistics,,,,B2C,Shipping and logistics,,,Delhi,,Angel investment,3,Vishwa Bhaskar,Saurav Sagar,Ranvijay Singh
206,Keyur,MSM Box,2014,World One Retail online beauty startup.MSM Box was started as a beauty & fashion blog.,Consumer_goods,personal and household goods,Internet_marketplace_and_eCommerce,Fashion,,Consumer_Products_and_Services,Clothing & Accessories,B2C,Online shopping for cosmetics,,,Delhi,,Angel investment,3,Bindu Sharma,Kavita Josh Rai,Hans Vivek
207,Keyur,Muvizz,2014, video streaming service in India focussed on only CURATED cinema from all over the world in different languages. Its a social platform wherein content discovery happens as an organic process. We are an online video streaming service (OTT) offering world cinema to film lovers around the world. Its a social platform to discover good content globally.,Technology,Software & Computer Services,Social_Platforms,Connect People for Sharing Media and Files,,,,B2C, online video streaming service,,,Mumbai,Maharashtra,Angel investment,2,Manoj Bajpayee ,Piiyush Singh,
208,Keyur,Myonsto,07/05,Myonsto.com is an e-commerce platform that enables users to purchase supermarket and grocery items.,Consumer_goods,personal and household goods,Consumer_Products_and_Services,Household Products,,Hyperlocal_and_Logistics,Online Grocery,B2C,Online shopping for grocery,,,Ahmedabad,Gujarat,Angel investment,1,Sahil Dalal,,
209,keyur,MyPoolin,2014,Startup which helps you to pool your money up to the target fixed for a purpose. People can Invite friends to contribute,Financials,Financial services,Fin_Tech_and_Payments, Alternative Funding Platforms,Crowdfunding,,,B2C,Facilitates money pooling needs,,,Delhi,,Angel investment,2,Rohit Taneja,Ankit Singh,
210,Keyur,NestAway,07/05,"Nestaway is India's largest Home Rental network. It helps people discover, rent and manage fully-furnished homes.",Consumer_services,Retail,Real_estate,"Buy , Rent and Sell Property",,,,B2C,Rental for residential purpose,,,Bengaluru,Karnataka,Angel investment,4,Deepak Dhar,Amarendra Sahu,Smruti Parida
211,Keyur,Nestaway Technologies Pvt. Ltd.,2015,"NestAway is India's fastest growing ""Home Rental Network""​ attempting to provide better rental solutions via design and technology.We help you find, book & move-in to a rental home of choice across Indian cities - all from within an App. Not just that, we help you move-in, ask for services from tap leakage to door lock broken, pay your rent & finally move-out - again all within an App.Whatever is your budget, whatever you call home (a bed, a room or an entire house), we have something for you.",Technology,Software & Computer Services,Real_estate,"Buy , Rent and Sell Property",,,,B2C,Rental for stay,,,Bengaluru,Karnataka,Angel investment,4, Surathkal, Amarendra Sahu, Jitendra Jagadev 
212,Keyur,Newgen Payments,2014,"Newgen is a multi-channel E-Commerce platform, international payment gateway (cloud-based & PCI-certified), and digital marketing company.",Financials,Financial services,Fin_Tech_and_Payments,Payments and Wallet,,,,B2B,Payment gateway and Digital marketing,,,Delhi,,Angel investment,1,Sunil Jhamb,,
213,Keyur,Next Door Learning Solutions Pvt. Ltd.,2014,"Next Door Learning Solutions Pvt. Ltd. develops and operates a Web and mobile application platform for online preparation for various competitive exams. The company offers mock tests, ebooks, question banks, and articles for SBI, IAS, RAS, SSC, UPSC, RBI, CSAT, GATE, and other exams. It provides information on various categories that include Indian culture, polity, computer knowledge, and GK English. The company serves students in India.",Technology,Software & Computer Services,Edu_Tech,Training for entrance exams,,,,B2C,Mobile app -enterances exam,,,Gurgaon,Haryana,Angel investment,2,Vipin Agarwal,Bhola Meena,
214,Keyur,NightStay,07/14,"NightStay, a last minute same day hotel booking app customised for the needs of spontaneous and last minute traveller.",Technology,Software & Computer Services,Internet_marketplace_and_eCommerce,Booking,,,,B2C,Booking-hotel,,,Delhi,,Angel investment,2,Nasr Khan,Deepak Negi,
215,Keyur,Noodle Play,2014,Some startups essentially offer an ordering platform from restaurants or independent chefs. Others run their own kitchen or serve ready to cook or read to serve meal boxes.,Consumer_goods,Food and beverage,Consumer_Products_and_Services,Food Products,,,,B2C,Food delivery,,,Mumbai,Maharashtra,Angel investment,1,Hitesh Bhatia,,
216,Keyur,Notesgen,07/05,Notesgen - a peer to peer student's notes exchange platform, that connects the best students from across the globe to other students looking to supplement academic and competitive exam preparations.,Consumer_services,Retail,Edu_Tech,Training for entrance exams,,,,B2C,Training for competitive exam,,,Delhi,Angel investment,3,Sushma Gulati,Manak Gulati,Roman Khan
217,Keyur,Novopay Solutions Pvt. Ltd.,2014,"ovopay pioneers a new way of electronic transactions at Retail – empowering businesses, merchants and consumers with technology forward solutions.Novopay Retailer App enables you to accept payments from your customers electronically.",Financials,Financial services,Fin_Tech_and_Payments,Payments and Wallet,,,,B2B2C,Receives payment on behalf on business,Banking system for business,Investment plan for the cunsumer,Bengaluru,Karnataka,Angel investment,1,Srikanth Nadhamuni,,
218,Keyur,Nudgespot,2014,"Nudgespot helps businesses communicate with their customers via its in-app messenger, browser & mobile push and email messages.",Technology,Software & Computer Services,Software_and_Internet_Services,Communication services,,,,B2B,Mobile app - connect customer and business,,,Bengaluru,Karnataka,Angel investment,4,Alok Shankar,Anubhav Sudha,Suresh Harikrishnan
219,Keyur,O Tree Solutions Pvt. Ltd.,2015,"O Tree Solutions Pvt Ltd provides customers information including photographs, timings, contact details, prices and reviews about sports and fitness facilities through its website and applications. It also provides a cloud-based software-as-a-service tool to owners of the facilities to manage their centres and helps them build their online presence.",Consumer_services,Retail,Consumer_Products_and_Services,Utility services,,,,B2C,Provides information to the customers,,,Nagpur,Maharashtra,Angel investment,3,Ujwal Sutaria,Narayana Vyas,Praveen Gadpayle
220,Keyur,OFB Tech Pvt. Ltd.,2015,"OfBusiness is a growing network of SMEs, leveraging technology to streamline and solve challenges across commerce, credit and marketing.",Financials,Financial services,Fin_Tech_and_Payments,Corporate financial services,,,,B2B,Providing solution to business on credit and marketing,,,Gurgaon,Haryana,Angel investment,8,Ntin Jain,Ruchi Kalra,Bhuvan Gupta
221,Keyur,Omapal Technologies Pvt. Ltd.,2015,"Omapal Technologies Private Limited, a fashion rental service company, operates Flyrobe, an online platform that provides apparel on rent. It offers dresses, accessories, such as jewelry and bags; and lehengas, anarkalis, gowns, sarees, kurta sets, crop top and skirts, dhoti sets, sharara sets, maxi dresses, and saree gowns.",Technology,Software & Computer Services,Internet_marketplace_and_eCommerce,Fashion,,Internet_marketplace_and_eCommerce,Borrow and rent goods and products,B2B,Rental service -fashion products,,,Mumbai,Maharashtra,Angel investment,1,Tushar Saxen,,
222,Keyur,Omnikart,2014,"Omnikart make strategic procurement on behalf of their customers. It provide an online catalog of products with all the technical guidelines, price and lead time from various suppliers. It is assigned to a group of people trained and skilled in negotiating, contractual terms and conditions, cost reduction and other purchasing techniques",Industrials,Industrial goods and services,Industrial_and_Business_Products_and_Services,Business Support Services,,,,B2B,Procurement goods on behalf of their customers,,,Mumbai,Maharashtra,Angel investment,1,Faisal Ansari,,
223,Keyur,OnlineTyari,2014,"OnlineTyari is a web and mobile app platform delivering educational contents, mock tests and guidance for students and job aspirants preparing for various exams in India. The company has partnered with various educational institutions, coaching institutes and individual tutors who provide quality material for various examinations like IBPS, SSC, UPSC, GATE, etc",Consumer_services,Retail,Edu_Tech,Training for entrance exams,Online courses and resources,,,B2C,Mobile app -enterances exam,,,Gurgaon,Haryana,Angel investment,3,Vipin Agarwal,Udai Meena,Bhola Meena
224,Keyur,Orangegubbi Technologies Pvt. Ltd.,2015,"Orange Gubbi Technologies Pvt. Ltd. operates as an e-commerce company that provides home décor, modular kitchen, and wardrobe products. The company offers living and dining products, such as entertainment units, shoe racks, crockery units, foyer units, and sideboards; kitchen furnishings that include L shaped, U shaped, straight, and parallel kitchen furnishings; and bedroom products, such as wardrobes, study tables, side tables, and book racks. The company was incorporated in 2015 and is ",Technology,Software & Computer Services,Consumer_Products_and_Services,Furnishings & Home Construction,,,,B2C,Interior designing,,,Bengaluru,Karnataka,Angel investment,1,Umesh Sangurmath,,
225,keyur,Orobind Fitness Technologies Pvt. Ltd.,2014,"Orobind is making it extremely easy for people to be healthy. By connecting people to trusted personal coaches through our apps, we make it possible for people to achieve their health goals and create healthier communities.",Healthcare,Healthcare,Health_Tech,Fitness & Wellness,,,,B2C,Marketplace of personal fitness coaches,Fitness and wellness,,Bengaluru,Karnataka,Angel investment,1,Satya vyas,,
226,Keyur,Oyofit Services Pvt. Ltd.,07/05,"OYOFit comes with a goal of making fitness fun and booking session a hassle free experience. We offer variety of options daily like yoga, zumba, pilates, aerobics, crossfit, dance, etc.
",Healthcare,Healthcare,Health_Tech,Fitness & Wellness,,,,B2C,Fittness and wellness  ,,,Bengaluru,Karnataka,Angel investment,2,Ruchir Garg ,Shivank Agarwal,
227,Keyur,Paix Technology Pvt. Ltd.,2015,Paix Technology Pvt. Ltd. operates an online marketplace for pre-owned cars. Its platform enables users to buy and sell used cars.,Technology,Software & Computer Services,Internet_marketplace_and_eCommerce,Buy and Sale goods and products,,,,B2C,sale of pre-owned cars,,,Mumbai,Maharashtra,Angel investment,4,Shanu Vivek , Suraj Kalwani,Ravi Chirania
228,Keyur,Paratus Knowledge Ventures Pvt. Ltd.,2014,"Paratus Knowledge Ventures Pvt Ltd. provides an aptitude development program for kids between 8-15 years. The company develops a Web application that enhances the quantitative, verbal, data inference, and creative thinking aptitude in school students. It offers structured and fun curriculum for developing cognitive aptitude.",Technology,Software & Computer Services,Edu_Tech,Training for entrance exams,,,,B2C,Training for competitive exam,,,pune,Maharashtra,Angel investment,1,Subramanya ,,
229,Keyur,Pay Technologies India Pvt. Ltd.,2015,"Pay Technologies India Pvt. Ltd, which owns and operates car pooling.solution and especially targets the office-going crowd.It allows users to build a trusted community of car poolers. Once verified, users can create their trips, and build a community of commuters who stay nearby or work in the same office.",Technology,Software & Computer Services,Hyperlocal_and_Logistics,"Taxi Services, Automobile pooling & Travel",,,,B2B,Car pooling for office crowds,,,Delhi,,Angel investment,4,Prajwal Zende, Rishabh Sawansukha, Ashutosh Sathe
230,Keyur,Paymango India Pvt. Ltd.,2014,PayMango India Pvt Ltd. develops a mobile marketplace platform for local businesses to manage and market their customer base. ,Technology,Software & Computer Services,Industrial_and_Business_Products_and_Services,Business Support Services,,,,B2B,Manages and maerkets customers bases,,,chandigarh,Punjab,Angel investment,2,Gajinder Singh,Ram Singal,
231,keyur,Phantom Hands,2014,"Startup to close the security gap by enabling Enterprise Security Operations to be Smarter, Faster, and Stronger. Phantom Cyber orchestrates key stages of security operations from prevention to triage and resolution, delivering dramatic increases in security operations productivity and effectiveness. ",Technology,Software & Computer Services,Technology_,Security & Surveillance Technology,,,,B2B,Security operations,Orchestration,,,,Angel investment,2,Sourab Sathish,Oliver Friedrichs,
232,keyur,Pickingo Logixpress Pvt. Ltd.,2014,"Pickingo is an on demand B2B hyperlocal delivery service. Cutting out the buzzwords, they take care of deliveries for your neighborhood stores. They seamlessly integrate to any merchants’ platform and streamline their delivery operations.",Industrials,Industrial goods and services,Hyperlocal_and_Logistics,Delivery services and logistics,,,,B2B,Delivery service to businesses,,,Gurgaon,Haryana,Angel investment,3,Attul mittal,Piyush sharma,Rahul gill
233,Keyur,Pilani Experts Technology Labs Pvt. Ltd.,2016,"Pilani Experts Technology Labs Pvt Ltd. operates a platform to discover and schedule calls with experts to get advice across various domains. It offers TapChief, a platform that connects individuals in need of advice in a specific domain to individuals who have expertise in the same.",Technology,Software & Computer Services,Consumer_Products_and_Services,Professional Services,,,,B2C,Connects with the experts of various domains,,,Bengaluru,Karnataka,Angel investment,1,Shashank Murali ,,
234,Keyur,Pink Blue Supply Solutions Private Limited,2014,"PinkBlue.in is an integrated supply chain solution for clinical/ medical supplies in India. It brings in thousands of manufacturers and tens of thousands of healthcare institutions into a single e-commerce platform, thereby creating the go-to platform for reliable discovery of better quality products and their best prices.",Healthcare,Healthcare,Health_Tech,Pharmacy & Medical Supplies,,Hyperlocal_and_Logistics,Delivery services and logistics,B2B,Delivery of medical product,,,Bengaluru,Karnataka,Angel investment,3,Arun Sriram,Valliappan Kumarappan,Varun Singh
235,Keyur,Plabro Networks Pvt. Ltd.,2015,"Plabro Networks Private Limited provides a networking and communication application for real estate brokers, property agents, and dealers . It offers PlaBro that offers an engagement platform for real estate brokerage firms, property agents, and property dealers to connect, network, and share information relating to real estate, housing, commercial properties, etc. The company’s PlaBro also enables agents and dealers to share information pertaining to lease, sale, purchase, rent, and other accommodation for commercial purpose. ",Telecommunication,Telecommunication,Real_estate,Property management services,,,,B2B,Networking and telecommunication,,,Gurgaon,Haryana,Angel investment,2,: Aaditya Jain , Pankaj Garg,
